,po,,,The Po's ability to kill three people depends on the choice they made the last time they were able to make a choice. It does not matter if they were drunk or poisoned when they made their previous choice.,
,po,exorcist,,"If the Exorcist chooses the Po, they do not wake tonight; this does not count as choosing no.",
,po,exorcist,chambermaid,"If the Exorcist chooses the Po, they do not wake tonight; the chambermaid learns the demon did not wake.",
,po,summoner,,"The Po only cares about choices made whilst being the Po. If a Summoner summons a player into the Po who previously made a choice of ""no one"" with a different ability, this does not allow the Po to kill three people.",
,po,engineer,,"The Po only cares about choices made whilst being the Po, if the Engineer turns someone into the Po who had previously chosen ""no one"" with a different ability, this does not allow the Po to kill three people.",
,po,pithag,,"The Po only cares about choices made whilst being the Po, if the Pit-Hag turns someone into the Po who had previously chosen ""no one"" while a different character, this does not allow the Po to kill three people",
,po,minstrel,,"If the Po chooses no one while drunk to the minstrel, they can still kill three people the following night ",
,po,monk,,"If the Po chooses a player who is monk protected, they cannot choose to kill three people the following night",
,po,innkeeper,,"If the Po chooses a player who is innkeeper protected, they cannot choose to kill three people the next night",
,po,courtier,,,
,po,innkeeper,,"If the Po chooses to kill no one while drunk to an innkeeper, they can still kill three people the following night",
,po,,,The Po must choose three unique people to kill and cannot choose the same player more than once per night,
,po,goon,,If the Po chooses the Goon they are made drunk and the goon changes alignment as necessary. All kills chosen after the Goon do not happen; kills chosen before the Goon still occur,
,po,innkeeper,,"The order of kills matters for the Po, if they choose to kill an Innkeeper protected player then the Innkeeper, only the Innkeeper dies. However if they choose to kill the Innkeeper and then an Innkeeper protected player, both players die.",
,po,tealady,,"The order of kills matters for the Po, if they choose to kill a Tea Lady protected player and then the Tea Lady, only the Tea Lady dies. If they choose to kill the Tea Lady and then a Tea Lady protected player, both players die",
,po,monk,,"The oder of kills matters for the Po, if they choose to kill a Monk protected player and then the Monk, only the Monk dies. If they choose to kill the Monk then a Monk protected player, both players die",
,po,snakecharmer,,"If the Snake Charmer chooses the Po, it is a new instance of the Po and as such the previous Po's choices do not factor into the new Po's ability to kill three players",
jinx,pukka,summoner,,The Summoner may choose a player to become the Pukka on the 2nd night.,
,pukka,pithag,,"If the Pit-Hag turns a player into the Pukka, it is a fresh instance of the Pukka ability and as such no players are poisoned",
,pukka,engineer,,"If the Engineer chooses Pukka, it is a fresh instance of the Pukka ability and so no players are poisoned",
,pukka,monk,,"If the Monk protects a player who is then chosen by a Pukka later that night, that player does not become Pukka poisoned. As such they do not die tomorrow.",
,pukka,monk,,"If the Monk protects a player who was chosen by the Pukka last night, that player does not die and then becomes healthy",
,pukka,innkeeper,,"If the Innkeeper protects a player chosen by the Pukka the previous night, that player does not die and then becomes healthy",
,pukka,goon,,"If the Pukka chooses the Goon, the Pukka becomes Drunk and the Goon changes alignment as necessary. The previous Pukka choice becomes health tonight but will die the following night when the Pukka becomes sober. The Goon never becomes Pukka poisoned and so does not die",
,pukka,barber,,"If the Barber dies to the Pukka, they die poisoned and as such the Pukka is not prompted to make a barber swap",
,pukka,sweetheart,,"If the Sweetheart dies to the Pukka, they die poisoned; no player is made Sweetheart drunk",
,pukka,heretic,,"If the Heretic is Pukka poisoned in final three, apply the Lleech Jinx",
,pukka,hatter,,"If the Hatter dies to the Pukka, they die poisoned and as such minions and demons are not prompted to make hatter choices",
,pukka,klutz,,"If the Klutz dies to the Pukka, they are sober and healthy at the start of the day when making their choice",
,pukka,moonchild,,"If the Moonchild dies to the Pukka, they are sober and healthy the following night when their ability would kill",
,pukka,plaguedoctor,,"If the Plague Doctor dies to the Pukka, they die poisoned and so the ST does not gain a minion ability, the ST also comes to regret their decisions and wishes they'd built a more fun bag for themselves",
,pukka,puzzlemaster,,"If the Puzzlemaster is picked by the Pukka, they are poisoned and so the player they are making puzzledrunk becomes sober. When the Puzzlemaster dies and becomes healthy, the puzzledrunk player becomes puzzledrunk again",
,pukka,recluse,,"If the Recluse dies to the Pukka, they are still able to register as a minion or demon & as evil when they become healthy",
,pukka,heretic,,"If the Heretic dies to the Pukka, they keep their ability when they become healthy",
,pukka,banshee,,"If the Banshee dies to the Pukka, they are poisoned at time of death; no announcement is made and they do not gain their ability",
,pukka,exorcist,,"If the Exorcist chooses the Pukka, they do not wake to choose a new player tonight; The previously poisoned Pukka player still dies tonight",
,pukka,sage,,"If the Sage dies to the Pukka, they are poisoned at the time of death so can learn two players who are not the Pukka",
,pukka,farmer,,"If the Farmer dies to the Pukka, they are poisoned at the time of death; no player becomes the Farmer",
,pukka,ravenkeeper,,"If the Ravenkeeper dies to the Pukka, they are poisoned at the time of death, and as such can be lied to when learning a player's character",
,pukka,snakecharmer,,"If the Snake Charmer chooses the Pukka, it is a new instance of the Pukka ability and as such no one is Pukka poisoned till the new Pukka choses a player",
,pukka,choirboy,king,"The Pukka chooses a player to poison before the previously poisoned player dies. As such, the Pukka can choose the King and then the choirboy the following night. This means the Choirboy is poisoned when the King dies and can be told false information",
Droisoned,pukka,,,"If the Pukka becomes drunk or poisoned, all current Pukka poisoned players become sober until the Pukka becomes sober. Players chosen by a drunk pukka do not become poisoned when the Pukka becomes sober",
,pukka,minstrel,,"If the Pukka becomes drunk, all current Pukka poisoned players become sober until the Pukka becomes sober. Players chosen by a drunk pukka do not become poisoned when the Pukka becomes sober",
Jinx,riot,banshee,,"Each night*, Riot chooses an alive good player (different to previous nights): a chosen Banshee dies & gains their ability.",
Jinx,riot,exorcist,,"If the Exorcist chooses Riot on the 3rd night, Minions do not become Riot.",
Jinx,riot,farmer,,"Each night*, Riot chooses an alive good player (different to previous nights): a chosen Farmer uses their ability but does not die.",
Jinx,riot,grandmother,,"If Riot is in play and the Grandchild dies during the day, the Grandmother dies too.",
Jinx,riot,innkeeper,,"If Riot is in play, the Innkeeper-protected player is safe from all evil abilities.",
Jinx,riot,king,,"If Riot is in play, and at least 1 player is dead, the King learns an alive character each night.",
Jinx,riot,mayor,,"The Mayor may choose to stop nominations. If they do so when only 1 Riot is alive, good wins. Otherwise, evil wins.",
JInx,riot,monk,,"If Riot is in play, the Monk-protected player is safe from all evil abilities.",
Jinx,riot,ravenkeeper,,"Each night*, Riot chooses an alive good player (different to previous nights): a chosen Ravenkeeper uses their ability but does not die.",
Jinx,riot,sage,,"Each night*, Riot chooses an alive good player (different to previous nights): a chosen Sage uses their ability but does not die.",
,riot,soldier,,"If Riot is in play, the Soldier is safe from all evil abilities.",
,riot,alchemist,devilsadvocate,?,
Droisoned,riot,,,?,
,riot,bishop,,"BAD, DON'T",
,shabaloth,exorcist,,"If the Exorcist chooses the Shabaloth, the Shabaloth wakes to learn who the Exorcist is, but does not wake to kill; a player chosen the previous night may still be regurgitated",
,shabaloth,exorcist,chambermaid,"If the Exorcist chooses the Shabaloth, the Shabaloth wakes to learn who the Exorcist is, but does not wake to kill; a player chosen the previous night may still be regurgitated. The Chambermaid learns the Shabaloth did not wake",
Droisoned,shabaloth,,,?,
,shabaloth,banshee,,"If the Banshee is regurgitated, they lose their ability to vote and nomminate twice",
,shabaloth,goon,,The order of choices matter for the Shabaloth. If they choose the Goon first they become Goon drunk and their second choice does not die. If they choose the Goon second their first choice dies and the Goon does not,
,shabaloth,,,A player coming back to life due to the Shabaloth ability happens before the Shabaloth chooses to kill anyone,
Droisoned,vigormortis,,,?,
,vigormortis,alchemist,,The Alchemist is not a minion so does not keep their ability on death,
,vigormortis,recluse,,"The Recluse can misregister as a minion when killed by the Vigormorts, poisoning one of their townsfolk neighbours",
,vigormortis,spy,,"The Spy can misregister as not a minion when killed by the Vigormortis, don't do this",
,vigormortis,,,Poisons minions neighbours not their own neighbours ,
,vigormortis,,,Poisons neighbours regardless if alive or dead,
,vigormortis,pithag,,"If the Pit-Hag turns the Vigormortis into another demon, dead minions lose their ability and players are no longer poisoned",
,vigormortis,engineer,,"If the Engineer turns the Vigormorts into another demon, dead minions lose their ability and players are no longer poisoned",
,vigormortis,,,"If dead minions stop being minions, they lose their ability and stop poisoning their neighbour. They cannot regain their ability",
,vigormortis,poisoner,,"If a Vigormortis killed poisoned chooses the Vigormortis, the Vigormortis is poisoned by the Poisoner. The Poisoner's neighbour remains poisoned",
Jinx,vortox,banshee,,"If the Vortox is in play and the Demon kills the Banshee, the players still learn that the Banshee has died.",
,vortox,savant,,A Savant in a Vortox game must learn two false statements,
,vortox,barista,,A player who is made barista 1 must recieve true information in a vortox game,
,vortox,knight,,The knight must learn the Vortox as one of the two players,
,vortox,boffin,,The ability granted by the Boffin does not yield false information,
,vortox,apprentice,,A good apprentice learns true information in a vortox game,
,vortox,fortuneteller,,"If the Fortune Teller chooses their Red Herring in a Vortox game, they learn a ""no""",
,vortox,fortuneteller,recluse,"If the Fortune Teller chooses the Recluse in a Vortox game, they can learn a yes or no",
,vortox,king,,"The Demon must learn a player who is not the King, as the King",
,vortox,nightwatchman,,The player chosen by the nightwatchman must learn a different player is the Nightwatchman,
Bootlegger,vortox,king,,The Demon learns who the King is correctly,
,vortox,monk,,A player chosen by the Monk must learn true information in a Vortox game,
,vortox,drunk,,The Drunk can learn true information in a Vortox game,
,vortox,philosopher,snitch,Minions learn three in play characters,
,vortox,philosopher,lunatic,"The Demon learns a different player as the Lunatic, and incorrect choices",
,vortox,villageidiot,,"If there are multiple Villiage Idiots, the drunk Village idiot still learns false information",
Droisoned,vortox,,,"While the vortox is drunk or poisoned, all townsolf ability works normally, as if there was no vortox in play.",
,vortox,magician,,Minions and Demons still learn the magician as a minion/demon,
,vortox,gossip,,The Gossip ability is uneffected by the Vortox,
,vortox,poppygrower,,"The Demon must learn players who are not minions, and the Minions must learn players who are not minions and a player who is not the demon as the demon when the Poppygrower dies",
,vortox,preacher,,Minions learn they have been Preached,
Bootlegger,vortox,poppygrower,,Minions and Demons correctly learn each other when the Poppygrower dies,
,vortox,mathematician,,"Every time a player learns false information due to the Vortox ability, it counts as an ability functioning abnormally",
Jinx,yaggababble,exorcist,,"If the Exorcist chooses the Yaggababble, the Yaggababble ability does not kill tonight.",
Droisoned,yaggababble,,,"Can learn an incorrect word day one, don't do this, phrases said while drunk or poisoned can still kill when they became sober or healthy the next night",
,yaggababble,lunatic,,The Demon learns how many times the Lunatic said their phrase,
Bootlegger,yaggababble,lunatic,,The Demon learns the Lunatic Yaggababble phrase,
,yaggababble,witch,,"If the Yaggababble has said their phrase, you can kill a player during th day when they nomminate to simulate a witch",
,yaggababble,psychopath,,"If the Yaggababble has said their prhase, you can kill a player during the day after a psychoapth claim to simulate a psychopath",
,yaggababble,golem,,"If the Yaggababble has said their phrase, you can kill a player during the day after they are nomminated to simulate a golem",
,yaggababble,harpy,,"If the Yaggababble has said their prhase, you can kill two players during the day to simulate a harpy",
,yaggababble,scarletwoman,,The Scarlet Woman can have a different phrase to the original Yaggababble,
,yaggababble,chambermaid,,"The Yaggababble wakes on night one when they learn their phrase, but does not wake following nights",
Jinx,zombuul,summoner,,"If the Summoner turns a dead player into the Zombuul, the Storyteller treats that player as a Zombuul that has died once.",
,zombuul,exorcist,,"If the Exorcist chooses the Zombuul, they wake to learn who the Exorcist is but do not wake to kill tonight. If the Zombuul is registering as dead, they continue to do so",
,zombuul,minstrel,,"If the Zombuul is registering as dead, they continue to do so even when drunk",
,zombuul,assassin,,"If the Assassin chooses the Zombuul, the Zombuul dies. They do not register as dead.",
,zombuul,mastermind,,The first time the Zombuul dies does not activate the mastermind ability,
,zombuul,scarletwoman,,"The first time the Zombuul dies, the Scarlet Woman becomes the Zombuul",
,zombuul,boomdandy,,The Boomdandy can kill the Zombuul and take away it's first life,
,zombuul,oracle,,A Zombuul that has died for the 1st time registers to the Oracle,
,zombuul,snakecharmer,,The Snake Charmer cannot choose a Zombuul that is registering as dead,
,zombuul,barber,,"If a Zombuul registering as dead swaps with an alive minion, they are not announced as being alive",
,zombuul,barber,,"If a Zombuul swaps with a dead player, the Zombuul dies",
,zombuul,harpy,,Deaths due to the harpy counts towards the zombuuls day death check,
,zombuul,cerenovus,,"Assuming it kills, the execution from the cerenovus counts towards the day death check",
,zombuul,tinker,,The tinker exploding counts towards the zombuuls day death check,
,zombuul,psychopath,,Deaths due to the harpy counts towards the zombuuls day death check,
,zombuul,golem,,Deaths due to the harpy counts towards the zombuuls day death check,
,zombuul,virgin,,"Assuming it kills, the execution from the virgin counts towards the day death check",
,zombuul,alsaahir,,The Alsaahir must guess a dead zombuul correctly to win with their ability,
,zombuul,slayer,,"If the slayer shoots a zombuul that has not previously died, the zombuul lives but registers as dead. If they shoot a zombuul registering as dead the zombuul dies",